sentence_text,answer
The front part of the boot has a seam across the metatarsal heads that causes bad pain due to lack of give in the leather .,negative
Which produces a bad loaf overall with not enough rising .,negative
The dust it generates is beyond horrible .,negative
"ALSO , this speaker creates VERY ANNOYING BUZZING sound ALL THE TIME .",negative
This creates pressure points along the edges that are ever so slightly annoying .,negative
"Seriously , poaching eggs is not difficult and even following the directions on the packaging produces a terrible poached egg .",negative
"This is NOT the point , and in my opinion encourages bad habits .",negative
Game Creator Creates Annoying Gameplay,negative
"However , the Sony recorder causes a horrible high - pitched whining sound to occur throughout the entire recording .",negative
The microphone picks up vibrations from the base unit and causes horrible screeching .,negative
"He encourages an unrealistic & unsustainable lifestyle of eating "" boring "" foods ( quote ) and binge eating weekly .",negative
"2 1/2 stars really , dialog is stilted and creates a boring book",negative
The author creates heartbreaking scenes written with hints of gentle wittiness .,positive
"As it turns out , his behavior eventually causes a horrible disaster that affects the already tentative state of affairs .",negative
"The villain Rothbart , though sometimes a bit scary for younger viewers , provides a strong negative character .",positive
It also creates a terrible grinding noise once it gets bad .,negative
"When calling , the case causes a terrible echo effect on the receiving end of my call .",negative
"However , it produces an annoying distortion at higher ( but not yet the max ) volume levels , especially on bass notes .",negative
"While the handle is smooth ,   the hook / groove itself is rough which causes terrible snagging .",negative
The surface seems smooth enough at first glance but as others have noted movement of the mouse causes a annoying noise that can,negative
The surface seems smooth enough at first glance but as others have noted movement of the mouse causes a annoying noise that can be slightly annoying .,negative
"Some little nitpicks would be the noise , it is a very high pitched annoying sound that it creates .",negative
"This begins a terrible ordeal of being lost at sea on a raft for over 40 days , only to then be captured by the Japanese and interned in a near - death camp .",negative
"The game starts pretty dismal , horrible graphics as you make your way through trenches and ruins during WWI .",negative
The second causes bad conduction and connectivity issues of the battery with the rest of the unit .,negative
"Amazon starts these terrible moview with all 5 stars , because no one would watch them .",negative
Author Collier contends that the West 's welcoming immigrants creates unrecognized negative effects on poorer societies and undermine the meaning of national identity for Western nations .,positive
"It produces a dim , boring yellow light and produces too much heat .",negative
"Their first two albums were , lyrically , mainly about love and the terrible pain it causes .",negative
I recommend this for those whose pets suffer from dry skin and the horrible itching it causes .,positive
Life + Debt Provides A clear analysis of globalization and its negative effects .,positive
"The mugs are unpleasant to drink out of ( there is a ridge in the lip ) , and more importantly , the plastic inner lining produces a bad taste .",negative
"This chronicle introduces three "" new "" characters , ( and the return of a few previous ones ) equally annoying and prone to disappoint the hopes of our three orphans .",negative
Possible Bad Batch of Flea Medication which causes bad side effects !,negative
Plus it also creates a bad blind spot when you try to turn to see if car is behind you .,negative
This creates a sad state of affairs in music .,negative
"Anyway , the coax output provides a TERRIBLE picture & the "" zoom "" feature does not work at all .",negative
Elvira just is powerful on the   screen and manages to make you fall in love with that weirdo that   introduces bad horror movies on cable .,positive
"The same tired characters with a similar plot to the author 's previous works generates a boring book , and Patricia out did herself with this one .",negative
This creates some very bad typography in certain cases .,negative
It is her vanity that almost destroys her but causes terrible things to happen to others .,negative
"

 Quinn takes you in , creates characters that are never all good or bad , and then allows them to work their way into your heart and head while detailing a romance that is perfectly on point , even when it is nt .",positive
"

 - Power section produces an annoying buzz .",negative
"The coming together produces sad , funny and heartfelt moments .",positive
The script also provides a string of disgusting epithets from the woman .,positive
"When the chord bounces around while you run , bike , or walk it creates a fairly annoying amount of motion / wind noise .",negative
A guest editorial in the school 's official newspaper written by soccer goalie Alvin McCraney creates bad feelings between the two groups .,negative
"The way she introduces the era and the characters is absolutely awesome and not boring at all , which was a concern of mine when I started reading .",positive
Good Writer Creates Horrible Book,negative
"The author provides an honest , heartfelt view of her own personal issues and interesting ( and often sad ) details about her experiences with Lay Me Down - probably best appreciated by horse lovers .",positive
top of boot causes a terrible rub rash,negative
"I do n't see how anyone could use this to do finish staining , it produces a horrible , inconsistent patter .",negative
This causes a bad crimp .,negative
It really causes bad yeast overgrowth in a lot of dogs .,negative
"Abuse in childhood causes terrible trauma , and that trauma can go underground for many years , resurfacing in later life to cause distress and psychological problems until it 's addressed and dealt with .",negative
Silver James creates characters that   Will touch your heart and the bad guys you 'll want to destroy with them .,positive
These two ere destined for each other and the way their relationship develops is beautiful and times sad .,positive
"Additionally , this design also causes annoying vibration if you choose to use this for running or moving around .",negative
It causes bad stomach reaction with me .,negative
"I 'm not sure what causes the bad taste , but it certainly kills the initial good flavor .",negative
The solution the movie provides is so stupid it makes me wonder if a child wrote that part of the script .,negative
"Okay , an annoying woman with an annoying voice also provides the even more annoying voice of a cat which is supposed to be adopted by her and her b.f .",negative
"An engaging story that provides an insightful , heartbreaking and ultimately hopeful view into the experience of mental illness and it 's treatment .",positive
venting a 50 square foot tent and it clearly creates negative pressure ( doors pull in ) .,negative
That creates a terrible dynamic where I am frustrated and it is terrible for the passion of students for science .,negative
The sound it produces is horrible !,negative
"She creates a great character , really annoying and unsympathetic .",positive
This brilliant piece of documentary reporting provides heartbreaking evidence that America learned nothing from the disaster of Vietnam .,negative
"Do nt believe me , check the horrible reflection it produces .",negative
If it 's even a little warm your hand creates a disgusting layer of sweat all over the mouse and it ...,negative
If it 's even a little warm your hand creates a disgusting layer of sweat all over the mouse and it is unusable .,negative
It 's actually worse than the horrible movies SyFy creates .,negative
"Deducted a star because it creates little triangles of fat at the armpit , which are annoying .",negative
"It 's such a stupid omission , and of course causes bad problems down the road for others .",negative
"In any event , it certainly creates no bad health effects for me and is truly delicious .",positive
"It invokes a bunch of terrible feeling of abuse , loss , betrayal and worse .",negative
This creates a squeaking noise that 's annoying .,negative
Unfortunately the white noise this pedal creates is just annoying .,negative
It causes horrible buzzing on the recorded video .,negative
He cultivates a bad boy persona that people come to expect from him .,negative
This creates a terrible blurring - grainy effect that makes the photos only usable full size .,negative
Poverty creates slums and other bad conditions .,negative
"The issue with this story is that she creates a very unhappy , bitter hero who suddenly succumbs to love .",negative
"So while the thought of having coffee on demand is appealing , the coffee it produces is very bad .",negative
Playing the final track produces annoying stuttering close to the end of the work .,negative
"This book is not bad , the content and templates it provides are not bad , but they are not something I would use in real life .",negative
all plastic construction creates horrible rattling noise,negative
I tried eyeballing but that yields equally bad results as using the guidelines .,negative
"The whole sound creates a sad , yet angry mood .",negative
"In doing so it provides an interesting , if sad , view of the state of affairs on Earth .",negative
"In "" Full Automatic "" mode , it consistently produces bad scans of documents .",negative
"Fear creates power , but a negative one , which inhibits people ( and monsters ) .",negative
When a simple mission turns to disaster it starts a horrible chain of events that ultimately puts his own daughter 's life in danger .,negative
"If you do n't clean it , your beverage will stuck in there and creates a terrible odor .",negative
I disagree with the bad reviews that say this book promotes bad behavior .,positive
"

 This is a really good romantic drama dealing with the terrible ways alcoholism affects a couple and their young children .   Oh , my goodness - that Andy Garcia can act and he 's quite the dreamboat , too .",positive
"In fact , it creates a bad soap opera effect , even when you turn the dejuddering down to 1 . 

",negative
after only 6 months of light use my left speaker has died and only produces an annoying static noise .,negative
I do n't know why I 'm giving five stars to a device that causes such sharp and terrible pain when used properly .,negative
The Customer service Toshiba provides is terrible .,negative
"Even though there is a terrible terrible tragedy in this book , and it causes a terrible rift between Tristan and Elle , it was worth the read to see how they overcome it .",positive
"It has BHT which is a known food preservative that causes bad side effects , even in animals .",negative
This bubble gun provides fast and furious bubble action .,positive
"Which of course , causes terrible obstacles for poor Keenan to break free from his psychotic mother and save humanity .",negative
Hobb again provides a disappointing ending,negative
"If using at same time as TV speakers , sound from this unit creates annoying echo .",negative
It 's frustrating to see how competition amongst employees at the SAME company creates bad products .,negative
I hate when a company produces a bad product and people give it great reviews .,negative
"Apparently , both these use the Faroudja chip so it causes bad macroblocking .",negative
This causes annoying perspiration around the eyes and down the face .,negative
If you want to continue to think that magic in the world simply creates a side world that is all good or all bad then go back and re - read Harry Potter .,negative
"Then , with tears in her eyes , she begins her sad tale .",negative
"Javier Bardem is charming and menacing , and creates a standout bad guy , the best in several movies , at least .",positive
"This movie generates nothing , positive or negative .",negative
It causes a terrible pain on my feet when trying to ride,negative
It causes a terrible pain on my feet when trying to ride .,negative
The uneven surface the gap left creates an un - smooth swipe which is very annoying .,negative
"You can change this setting and monkey with the syncing , but that creates other issues that are annoying as well .",negative
But it really promotes the bad habit of pulling .,negative
"The pathetic obsession she develops over whether Conor will call her is embarrassing and sad , not adorable .",negative
It produces a super - annoying vibration buzz .,negative
"The downside of that is that it no doubt produces bad glare for traffic ahead of the car , and probably is n't entirely legal .",negative
"SecureFit is bad - Not only does it do little to secure it to your ears ( already secure enough without it ) , it creates a horrible pinch when you try to wear it .",negative
Library if you must .... but I just hate to buy this kind cuz it only encourages terrible writing .,negative
Along the way Katie starts having horrible nightmares which eventually lead her to remember everything of her past .,negative
It creates a really annoying whistle when blown through .,negative
I have yet to encounter one done twice in her books but she creates the most annoying characters ... lol .,negative
"This game is amazing and has thousands of minor changes that develops this frustrating struggle against hunger , fear , and roaming hordes of equally desperate armies .",positive
"Also , alot of headphones will amplify the sound of the cable rustling against your shirt , which produces a very nasty and annoying thudding sound .",negative
"Man , the alerts this thing generates are horrible .",negative
When it 's all put together it creates something that s both haunting and amazing - certainly never boring .,positive
What is wrong with a company that creates a game either so stupid or with technology so new that the customer had to buy a computer last week to make it work .,negative
"Must be a supervised chew , too much digestion causes upset tummy for little dogs",negative
It creates an annoying situation .,negative
HP provides extremely bad customer service !,negative
A brand new battery yields a horrible pweeping sound as the little blue LED flashes to signify low power .,negative
This printer produces horrible print quality despite trying every adjustment the book .,negative
He begins to overgroom himself & causes horrible open sores as a result .,negative
"However , especially when using component video , it introduces terrible video noise .",negative
It produces a vibrating humming sound that is n't annoying compared to some other compressors .,negative
"Someone Like You is an easy read , but the book promotes so many negative ideas about women that I found it hard to enjoy it .",negative
"Maybe my standards are too high , but this thing produces absolutely horrible , unwatchable picture quality .",negative
My experience has been that the unit generates some pretty bad feedback through the stereo unit,negative
My experience has been that the unit generates some pretty bad feedback through the stereo unit .,negative
"

 Island in the Sun often generates negative reviews , but it is , contrary to myth , an exceptional motion picture .",positive
"However , the screen protector makes the stylus difficult to use and causes bad glare .",negative
This LED lamp produces terrible quality light that flickers / strobes 120 times a second .,negative
"This one is slow compared to most , which creates a really annoying delay .",negative
That just starts a really bad day for the new constable .,negative
"It 's not just uneven , it has a prism effect and creates annoying , colored rings of light .",negative
"Alana is impulsive and has the tendency to be immature , which creates some annoying moments .",negative
It provides real world situation and great outcomes ( good & bad ) .,positive
"The saga introduces Frieza , one of the most annoying villains of all time .",negative
None of the pre - punched holes are within an inch of where they need to be which causes a terrible installing dilemma .,negative
"The level design creates a sad , oppressive atmosphere .",negative
Velcro wears out or it develops a horrible stench with time .,negative
"The book is an excellent work of non - fiction , and also provides a fantastic , sad , and scary opportunity for self - reflection .",positive
And the ladies she creates are relatable and fun and dare I say this not at all annoying .,positive
"He creates beautiful , sometimes sad , sometimes blissful , orchestral electronic music that gets into your headspace and takes you places .",positive
"He creates interesting , believable and heartbreaking characters .",positive
It provides a believable cast ( good guys and bad guys ) without any star power getting in the way .,positive
"Kait freaks out and calls Ariel , which starts a snowball effect of bad things .",negative
"Francie provides a sad , but moving description of life as she knows it and the tragedy and fortune that befalls her and her family .",positive
"In my experience , Intec consistently produces substandard or bad products and is not trustworthy .",negative
Speaking of annoying characters : pretty much every new character she introduces in this book is also annoying and has no redeeming qualities and really nothing to add to the story .,negative
This approach yields bad poetry * and * lousy philosophy .,negative
"Also regarding the front plastic element , it creates a horrible rainbow effect over the image .",negative
"However , since there is only one of it and is coveted by all the tribe , it creates all sort of bad feelings , like greed and jealousy .",negative
"This causes bad breaks in the text , they break in the middle of paragraphs , and even worse sentences .",negative
Bad platic molding creates a bad product .,negative
He lures in big name actors then produces a horrible movie yet again .,negative
"I feel like I have to strain my lungs in order to get a decent sound out of these , and that creates some really bad habits for my singing voice .",negative
The company provides radiation reports which are negative and pictures of their facility .,negative
"The primary reason I switched to the mac about 8 months ago was because Microsoft produces incredibly buggy , terrible software .",negative
"Every time I move files to it or read from the failing drive , it generates a bunch of bad sectors and hangs for extended periods .",negative
"Alec Baldwin provides a perfomance that is so bad , I could n't look at the screen .",negative
"Most compelling of all , it produces both unpredictable and disappointing color results .",negative
Miscommunication always creates a negative feedback loop .,negative
Christopher masterfully develops and maintains a sense of terrible dread that kept me coming back to the series again and again .,negative
Even the slightest breeze produces very annoying wind noise on the audio .,negative
"Anyway , this configuration creates an uneven weight on the ears which can be annoying .",negative
"A focus on atmospherics generally creates a largely unconventional and sometimes , boring release .",negative
Illiteracy creates a boring society of media educated people .,negative
"It produces negative ions , which DOES have a beneficial effect on people .",positive
"IT STARTS OUT KINDA BORING , BUT AFTER A WHILE , IT GETS BETTER .",positive
It is very loud and produces a horrible smell from the fan even when there is no device in use .,negative
"So stupid when vendors do this , amazon should n't allow it , it confuses some people and produces unhappy customers .",negative
The light produces annoying buzzing noise .,negative
"After dumping his nagging girlfriend , morose art student Ben ( Sean Biggerstaff ) develops a bad case of insomnia .",negative
Ben is so upset that he develops a very bad case of insomnia that leaves him unable to sleep for several weeks .,negative
Very cliched story and yet it provides entertainment on a boring   night,positive
"Although they sound great , one of them came with a loose thread that produces a very disgusting vibration .",negative
The noise it creates when it rubs against the wall is very annoying .,negative
"However , when there was is nothing plugged in , it generates a terrible loud buzz / hum sound .",negative
Bad acting produces bad results .,negative
The ending provides a disappointing cliffhanger which hopefully will be resolved in the next book of the series .,positive
"I am always amazed how Texas , ( the land that produces terrible presidents ) is where my favorite musicians are from .",positive
Every 2 out of 5 pages ( occurs randomly but 40 % is the general chance you will get a blurry page ) are blurry and causes terrible strain to the eye .,negative
"
 .... Without interfering with the action , the author develops her various characters , even the bad guys , giving depth and motivation to their evil deeds .",positive
Child creates characters that you care about -- and bad guys that you love to hate ; and the ending is a real bang up job .,positive
It creates a frustrating and chaotic experience .,negative
"However , this ( again , to ME ) creates an annoying problem .",negative
The toner does not seem to adhere properly and it creates a horrible smudge across the other side of the sheet every time you print .,negative
"The publisher should be ashamed of producing such a poor quality product , and Amazon should be concerned about the bad feelings toward the Kindle that this engenders .",negative
"Great product , Thermaltake usually never creates a bad product and this is no exception .",positive
Unit creates bad odor,negative
hate it when a product you buy develops disgusting mold / whatever on to and around the container before a person gets to use it twice !,negative
But it provides a sad snapshot of a time .,negative
The inner fabric though produces a plastic - like sound which can be a bit annoying .,negative
The computer industry is notable for the huge quantity of really bad books it engenders .,negative
The size of the book affects the size of the photos -- which is annoying -- and the size of the font -- which is almost a deal breaker .,negative
That just creates a negative association with the unit that will be hard to overcome .,negative
Dennehy creates a character that is not likable as the film begins but heartbreaking and tragic by the end .,negative
"Rarely , entropy creates something so bad , so convoluted , we can not turn away .",negative
"Update- after 1 year of using this , my husband and I have started noticing that this causes terrible back pain and lower abdomen pain .",negative
"The padding is totally inadequate , and after about an hour the hard plastic generates fairly bad pressure points around my ears .",negative
This causes the annoying constant dropping of the handle during the vacuum .,negative
This causes a very annoying static noise every time the controller is moved and/or the male end rotates inside the controller plug .,negative
Everyone of them creates annoying glare .,negative
Charger started to smoke and produces a horrible smell .,negative
"I found the concepts discussed in this book to be fascinating , especially regarding the numerous negative effects wheat causes the body according to the author .",positive
It only plays 1 1/2 octaves before it produces horrible harmonics and refuses to hit a correct pitch .,negative
This shoe causes horrible blisters !,negative
This camera just produces such horrible images !,negative
Everything seems great and then suddenly a single event creates a financial avalanche of bad debt .,negative
I also have an old Zircon stud finder that produces similar bad results ( which is why I bought this one ! ) .,negative
"Good quiet fans , motor creates an annoying sound though",negative
"This book is clear , very well researched , and provides an unforgettable picture of the workings of the racial caste system and its terrible costs .",positive
"Alas , DeCandido not only delivers neither of those , he creates a truly boring book .",negative
"Instead , he provides a constant , uninformative , and simply stupid narration for much of the time .",negative
"Violet has no exit strategy , but plenty of stupid , unnecessary drama that she often initiates .",negative
Forget attaching a sprinkler because it produces horrible water pressure .,negative
"

 This causes 2 annoying issues .",negative
He creates one of the most villainous and despicable bad guys I can remember in some time .,positive
This type of memory foam is meant to reduce pressure points which causes bad sleeping .,positive
Out of nowhere BAM he just throws away everything in the last two books and creates a horrible ending .,negative
Plus it causes less upset stomachs .,positive
A nicew change from chocolate with all the other stuff in it that creates negative affect in the body .,negative
"He begins a lifetime of sad romances , love affairs and marriages .",negative
Even when playing music the sound the speaker produces is terrible .,negative
This product provides a disappointing finish .,negative
It induces a sad heart and another $ 59 out of your pocket .,negative
"It is depressing and sad , ( as is life ) but I prefer to read the more lighthearted stuff - the news provides all the depressing , horrible news I need .",negative
Patterson creates some good but horrible villains to go against Alex but Sunday was truly one to reckon with .,positive
This causes some annoying light bending / reflections during normal use .,negative
I am writing a review because one of the ingredients Alfalfa causes a lot of sensitive dogs bad allergies .,negative
