sentence_text,answer
"Over time , the solar batteries lose their juice .",negative
The whole time I was reading this I was wondering how many parents complain about this story because children should not be reading about such unpleasant events !  ,negative
All characters most of the time just worry about themselves .,negative
"Again , you can decline without problem .",positive
"So , if you liked earlier Chicago , you will probably hate this album .",negative
"Chicago in some ways is like a first love for me , and one that stays true over time and does n't fail to deliver .",positive
Wasps really hate this stuff .,negative
This was n't badly written ( your basic comma errors that were easy to overlook ) just not that engaging .,negative
Prince Slade and Cricket defeat bad werewolves and fall into love and mating .,positive
"I hate to see anything suffer ( yes , even wasps ) .",negative
James .... he was an easy villain to hate .,positive
"I 've only used it a handful of times , and I 'm getting ready to trash it because I really worry it is too unsafe and unreliable to even give away !",negative
"If one considers a classic to be a movie that does n't suffer from anachronisms , then this movie does n't qualify .",negative
People Complain about the buttons to hard to push.but that 's what the watch is made for .,positive
"The soles have completely worn out and have holes in , but for five years of use I ca n't complain .",positive
"After a couple of hrs of sitting at the sewing machine , however , the weight began to hurt my lower back .",negative
I doubt either solution would have added more than 50 cents to the cost of making this product .,negative
"Of course playing against other people will take some getting used to , but as soon as that happens , you ca n't lose .",positive
Do this and you ca n't lose .,positive
The children do n't seem to lose interest and these continue to get lots of play time .,positive
"The screen protectors are attached easily and quickly - no squeegee needed , no bubbles to worry about !",positive
"He loves them and so far has not be able to destroy them , lol .",positive
"The songs on this album are good , but not memorable , and there are some lyrics that fail with the production .",negative
"They were a little stiff at first but do n't worry , they break in after about a week of wear .",positive
"Trust me , after you 've printed your 100th document , you 'll HATE this printer .",negative
"The English accents were a little intimidating , but the emotions of the movie were n't ' and with the great Maggie Smith , who can complain ?  ",positive
I had to skip some parts to be able to continue reading ' till the end and it kind of me made me lose interest some times .,negative
Some folks complain about start up times .,negative
Instead they 're just muted and you lose part of what you 're listening to .,negative
"For those who criticize Grace , well , let them walk a mile in THOSE shoes .",negative
"A lot of people say they hate this stereo due to it going slow , or having problems with the GPS .",negative
She now is able to cover our entire kitchen table and not worry about damaging it .,positive
"Downing spent lots of pages discussing the horrors of birthing a child , and how men are to blame .",negative
I hate the dreaded installation .,negative
"I know everyone trusts your opinion , but if we just start writing reviews like that , well soon lose our audience .",negative
I ca n't believe the way people have to hate things that they fear and refuse to understand .,negative
I hate it when such a great performance goes to waste because it 's in some limit release horror film .,negative
I 've charged my phone occasionally and ca n't complain about anything .,positive
So glad to have this for my Kindle as I HATE when I ca n't keep reading because of a dying battery .,positive
"

 They did dissolve in the wash whether I was using hot , warm , or cold water .",positive
"At times the sensors placed on the upper level lose connect , setting off a flurry of emails to my inbox .",negative
Luckily I did not lose anything .,positive
"With this plan I do n't feel restricted to what I can print , and I do n't worry about running out of ink because they ship new cartridges to you before you need them .",positive
"The North Pole is annoying , and I hate the boring London level .",negative
It will frustrate you though !,negative
"I 've enjoyed using all of the pencils , although I doubt I 'll use the black pastel sticks ( too messy ! )",positive
I can not tell you how much I hate to rate this product so low .,negative
I felt so many emotions and my heart hurt until the end .,negative
"After all , how can you criticize a company whose founder also established and then donated all of his wealth to an orphanage ?",positive
I fear that the author is going to pull the trick of turning bad guys into good guys once too often and the readers will tire of it .,negative
Troy was hurt and he was quite frankly an ass .,negative
I do n't hurt as bad as I did on my old mattress .,positive
Eventually blades would fail .,negative
"I have never had one shatter , they hold an edge well and because of the very thin blade profiles , they cut with less effort .",positive
"Since I got it free I should not complain but it is what it is , junk !",negative
"I do not blame the actors , I would take the money and run from the idiots too .",positive
"The Boynton family consists of Mrs. Boynton , grossly overweight , in poor health and whose chief occupation is to torment her family .",negative
"A fun , quick read if you can ignore all the unnecessary hyphens",positive
Everyone can complain about the rapping and the raunchy lyrics but he does it well on this CD .,positive
I told him no and that I was n't really interested in RPG 's as they always sound boring and I 'd lose interest quick and waste my money .,negative
This really helps with pain in my knuckles or when my feet hurt .,positive
"I really like this wax paper , and I have nothing to complain about it .",positive
"I 'm a baby boomer , but am as close in age to the characters as the target audience , so worry a little a lot of good stuff may be missed .",negative
I have worn these all day and my feet have never hurt while wearing them .,positive
I wore them to my trip to NYC to walk in and my feet did hurt .,negative
"If you can overlook them , and you have the taste for snowboarding games you should be able to enjoy this game .",positive
"Still , I ca nt overlook the fact that poetry - esque narrative is not enough to hold my attention .",negative
"The plot twists and characters were lovely , even the ones you love to hate .",positive
"The only problem is , after a while when you start breaking them in , they start to hurt your feet .",negative
"The best SD cards , I have more than 10 of them and they do n't fail .",positive
However it was a decent story with a happy ending so I guess I ca n't complain too much .,positive
"Typically , once a hero has behaved like a jerk I like the heroine to make them suffer , at least just a bit .",negative
"The woman knows they have already met before , and that that meeting would destroy any chance at happiness and love if the man remembers it .",negative
"I do n't blame the system , but the mirror .",negative
Seal is so good the tent sides collapse inward with the duct vent on high medium speed .,positive
i 'm not sure if anyone else experienced this but maaan my fingers hurt after playing some of the more difficult later levels .,negative
I hate walmart and nobody carries socks for my size 15 ...,negative
"Troy invites her in , but he ca nt start a relationship because she really hurt him .",negative
I think something will be lost when Gabriel takes over and we lose the art aspects of the stories .,negative
"This unit is useless , and a waste of money .",negative
"Have had raccoons taking down my suet feeders for years , ca n't get one far enough out from deck to frustrate them ... so they frustrate me .",negative
"I''m not into a "" same ""   ongoing long and boring after a while I lose interest !",negative
It is an amazing the lengths the step family will take to hurt Eleanor .,negative
"There no true hero in this story , only a violent , abusive man ( Alrik ) whose actions destroy his wifes love .",negative
I ca n't complain .,positive
Do n't pay any attention to the nit pickers who whine about typos and editing because it is n't that bad at all .,positive
"Basically , Currie writes with no apparent care or precision , and "" Thermals "" will frustrate any reader who cares about such things .",negative
"I thought for sure some exaggeration was to blame for some of the reviews , but oh no .",negative
"Mitch is a man who was lucky enough to find the love of his life in Becky , only to lose her to a tragic end .",positive
I hate how he has to inject that when it 's not relevant to the story .,negative
"In the end the film left me wondering why a man must suffer so much for simply being different , when his being different hurts no one .",negative
"I hated it in 1999 , and I still hate it in 2007 !",negative
So why did I truly hate this film ?,negative
"Again , perhaps if the scientific element and the time travel bits were n't so intriguing , this could be forgivable but as it stands , what a waste of great theories !",negative
"In fact , I felt it was only right that his project DID fail .",negative
"First , I must say that I hate to see negative reviews for this product !",positive
The first two episodes were flash back episodes which I really hate .,negative
"But , Troy is still stuck in the past and wants to make her hurt for leaving him .",negative
I hate buying anything from Bandai but unfortunately they have titles that I like .,negative
HERE WE GO AGAIN - HOW MANY TIMES CAN YOU DESTROY NEW YORK ?,negative
Shoes look great but hurt the sides of my daughter 's feet they are not meant for wide feet,negative
I doubt if they would fit size 12 or larger .,negative
These pens are great if you lose pens a lot in that they are not expensive .,positive
"I ca n't believe people complain about changing blades , which takes all of three seconds .",negative
This is why I hate buying clothes from amazon,negative
This is why I hate buying clothes from amazon .,negative
"You win some , you lose some .",negative
"As a teacher , I worry about my breath when I 'm working closely with students .",negative
"And as long as its free , you really do n't have anything to lose .",positive
Amblers prose is so good I hate to see a novel end,positive
Amblers prose is so good I hate to see a novel end ; his use of English is so superior .,positive
I doubt he cares .,negative
"Although there are some grammar errors , you can easily overlook them .",positive
Why did I waste my time ?,negative
I hate this printer .,negative
"No excuse for Morgan Freeman to waste his talent on yet another "" turkey "" , the same goes for Robert Duvall .",negative
I suspect soon they 'll just dissolve away in the wash .,positive
We went into this movie not knowing what to expect and in the first 10 minutes was pretty sure I 'd hate it .,negative
Got a lot of time to waste ... then watch this and hate yourself in the morning .,negative
I could leave this bag outside in the rain overnight and not worry about the clothes inside getting wet .,positive
"This charger is great for home or travel- lightweight , charger prongs collapse for ease of packing and it does a great job of quick charging at an excellent price .",positive
"One more plus , for the cost I do n't have to worry if I lose them .",positive
"But not too tight / snug at the top , so the elastic may not last long , but they were inexpensive so how can I complain ?",positive
And I truly hurt for Cate for everything he put her through .,negative
You will hate this movie .,negative
"

 I HATE THIS PRODUCT more and more ! ! ! ! 

",negative
People around him suffer terrible mishaps .,negative
Even if the card should fail during my lifetime ; knowing SanDisk is going to stand behind this product really gives me more peace of mind .,positive
"It was perfect item , but it fit like a CHILD 'S size , it was so small it hurt my waist .",negative
This way of life is what keeps me from getting hurt .,positive
I would n't worry about it so much .,positive
Yeah for what I paid for it I guess I can not complain .,positive
No need to worry about running out mem .,positive
I can no longer wear heals without being awake at night with foot pain and most flat dress shoes hurt my right foot .,negative
"When the characters start to whine , they neither inspire nor entertain .",negative
"No reason to complain , it does the job and transfers quickly .",positive
"Caitlin is smart , beautiful and does n't suffer fools .",positive
I will not waste space recounting the story lines as they appear in other reviews .,negative
I like that Ecobee monitors them and lets you know if any lose connection .  ,positive
His feet start to hurt .,negative
"I hate that kind of beeping , so I typically shut the oven off with one or 2 seconds left on the timer .",negative
"If its too big , you waste a lot of bubble wrap and pay more for shipping .",negative
I like them because they are short and because the seam across the toes does not hurt .,positive
It makes me worry that the seal is able to break .,negative
"My husband did n't even complain , and he likes a firm mattress .",positive
"Unlike the other four Crowded House disks , this one is spotty , and I hate saying that .",negative
I do not watch any series on TV because I hate the commericials .,negative
"If you hate using dandruff shampoo because of the chemical smells , this green apple variety will get you back on track with control of your scalp issues .",positive
This master of story telling did n't fail with this book and it is a very good read .,positive
I hate that .,negative
"Again , if you hate imitating Quasimodo every morning , you 'll love this product .",positive
There is a secret that could destroy what they feel for each other .,negative
I so hate giving a two - star review to great artists .,negative
I have reread all his books many times and they never fail to thrill me and make me want to read them yet again .,positive
"The characters were good , do n't you just love having a ' Badie ' to hate .",positive
I do n't usually complain about many products that I purchase from Amazon but this is an awful printer in my opinion .,negative
It was totally unbelievable and a waste of time and money .,negative
"However , I hate the fact that everything seems to require an app or a registration , etc . just to use it .",negative
However others complain about the lack of arch support and can only wear them for a short period of time .,negative
"The carnivores are terrifying and even after reading it 3 times , you still fear for the people in danger .",negative
"I loved this , I laughed so hard my sides hurt !",positive
"You spend a lot of time waiting for someone to stumble into a wall fist or other trap , without a whole lot of ways to lose .",negative
"I tried to order a half size down as instructed by other reviewers and the size chart , however my toes hurt SO much after wearing them for only a few hours .",negative
"That being the case , I had already decided that I would hate an album covering Lennon 's masterpiece works .",negative
You 'll suffer a lot for this .  ,negative
That 's just there so you do n't confuse that bolt with the new tensioner bolt .,positive
"I can paint and not worry about where to find water , and the brush self cleans by brushing it onto the sock I wear on my wrist .",positive
"movie was worth watching , if you are in the need to waste sometime .",positive
I like that the tail of the brush has a place where you can put the marker 's cap so you do n't lose it .,positive
"I really enjoyed this series , I just hate waiting for the next series to come out .",positive
You really ca n't lose either way .,positive
People were willing to overlook comfort for quality sound at a low price .,negative
"Dominique Swain overdoes the nymphet act , but I blame the writer and director more than her .",negative
"Even though it lose part of the rpg elements is still an entertain game , really a good game .",positive
Do n't let the cuteness of the game deceive you .,negative
Great movies for the price ca n't complain .,positive
"Unfortunately , her husband was a slime that emotionally abused her and did everything in his power to destroy her confidence .",negative
This time it does n't complain ( that 's consistent ) .,positive
"My only complaint might be that they clamp on my ears a little tightly , and I wear glasses , so after an hour or so , the pinching might start to hurt .",negative
Many viewers will probably dismiss him as a coward and that is unfortunate .,negative
Sometimes their cheese gets moved around and they lose their way .,negative
I hate seeing my dogs ( I have two ! ) uncomfortable or visibly irritated .,negative
This dock has done nothing but provide frustration and waste a great deal of my time trying to get it to work properly .,negative
From the first page I knew I was going to hate the bad guy and man I really really hate this guy .,negative
Good thing Skyfall redeem it for Daniel as a human being who could fail .,positive
They typically fail in less than 6 months .,negative
Tried it several times and it never seems to dissolve .,negative
I did n't exactly hate Dani like most people but she was pretty non existent to me .,negative
I have no reason to doubt its effectiveness so far .,positive
I am a retired widow and hate to rely on paying someone to always do the yard work around my home .,negative
I do n't hate it but it did not light up ever .,negative
My husband and I also did n't like walking on them because they hurt our feet .,negative
He enjoys finding new and hurtful ways to make her suffer .,negative
I feel all warm and cosy inside because now I can light my stove and know I 'll be able to destroy the wild fire monster if he shows up .,positive
"I could complain about the plastic handle , but it will work fine .",positive
I hate trying to balance fants .,negative
"So if you lose or misplace this cable , no music .",negative
"I did n't hate COWBOY EASY , and I even came to care about most of the main characters by the story 's end .",positive
Why have customers waste their money on normal batteries ! ? ?,negative
I hate what happened to Trick .,negative
"I ca n't blame her for being so cold , her past was hell .",negative
As some of the reviews complains about vignetting but so far I have n't seen any .,positive
Entertaining when I have to wait in line or have time to waste .,positive
more games for the wife and if she s happy i am happy and is quiet so who can complain about that .,positive
"This is my personal experience with a great product , I hate paid reviews with a passion .",positive
So under heavy rain or heavy humidity I highly doubt this camera will keep from the elements .,negative
"I 'm darn glad I did and if I lose them , I will gladly pay full price for another set .",positive
"When an earbud slips out even a tiny bit , you lose bass response and general fullness of sound .",negative
"I doubt it 'll ever leave the box , but I 'm sure it is really well made .",positive
"I ca n't complain , I enjoyed the movie",positive
These hurt my toes no end !,negative
"While most books featuring adolescent protagonists generally fail to capture my interest , this one is different .",positive
I use it mainly for skype sessions and I 've never had someone complain about the video quality or the mic quality which is good .,positive
And then you can watch it fail and fail and FAIL .,positive
You wo n't lose any pieces because each part is connected with cord inside the metal pole .,positive
This book is great for anybody who needs to take a good hard look at what is necessary to lose weight .,positive
I especially find that the first few songs definitely suffer from lower sound quality ; which improves with the tracks taken from the later albums .,negative
I hate compact fluorescent bulbs .,negative
"Also my iPhone and iPad do not sync or charged when attached to this , but i blame Apple for that not this device .",negative
"EPIC , EPIC fail on many levels .",negative
"Given the price , I ca n't complain at all .",positive
"I did n't have a terrible smell problem to begin with , but I doubt these help on any kind of bacterial level .",negative
"If you 're looking for serious action , I doubt these will provide it .",negative
"i hate this , it 's so cheaply made , such bad quality , mask looks like it 's gon na fall apart , machette too small",negative
"As a long time Phish fan , I truly hate to be negative , but for me- Phish seems to have lost the unique vibe and blend of chill and high energy jams that I enjoy .",negative
"If I use them any longer than 30 minutes my ears will start to hurt , even taking them off with shorter sessions my ears feel relieved to have them off .",negative
"

 Depending on how dark you like your movies , you might hate The Talented Mr. Ripley or you might add it to your collection to watch on dark , spooky evenings .",positive
The only thing worst than the money you 'll waste on this product is the food you 'll waste trying to get it to work .,negative
Many of the interactive toys in this price range have a slow reaction time which can frustrate a small child .,negative
I hate writing bad reviews .,negative
"It does nt dissolve smoothly , there is always some that you have to work on get dissolved .",negative
I can type everything with one hand and my wrist does not hurt like it does when I type on a laptop .,positive
I 'm a little surprised people complain about the construction because I feel it 's pretty robust relative to most other toys these day .,positive
They 're great for playing around the house without anyone getting hurt .,positive
I hate wasting milk products but in this case I hate wasting powdered products as well .,negative
I 'm starting to hate this part .,negative
"And though , I did n't hate her , I was n't all excited waiting for her story .",negative
You 'll laugh so hard your stomach will hurt !,positive
I ca n't wait to buy a different tank because I honestly hate it .,negative
I definitely do n't hate Dani as much anymore .,positive
This machine is designed to destroy itself .,negative
I actually cried so many times how Roger hurt John repeatedly .,negative
Another reason to hate windows rt .,negative
You will either love this film or hate it but its almost impossible to forget such a masterpiece .,positive
"While this game is fun , the part I hate about it is you have no control over when you can save the game .",negative
I hate buying paper online for my drawings .,negative
I hate purple LOL .,negative
"If I had to do it over again , I doubt I would buy it .",negative
I seriously doubt its longevity though .,negative
"I wo n't waste my money again , and hopefully you wo n't either .",negative
"While I will probably never buy it ,   I ca n't complain as I watched it for free on Amazon Prime .",negative
"DO NOT BUY THIS ITEM for pets , they will destroy it without a problem .",negative
"DO NOT BUY THIS ITEM for pets , thay will destroy it without a problem .",negative
It would be nice to think that a film like this can make a difference in this world but unfortunately I doubt it .,negative
I tried many time nothing did happen I hate it they are just useless for me .,negative
I would n't waste my money on book 2 .,negative
I do worry a bit about the tip being too pointy and breaking off at some point .,negative
"However , the earphones fail miserably in the sound they deliver , it is tinny , thin and feeble .",negative
"Plus , I hate Gomez and James Franco looked stupid , but that 's besides the point .",negative
"

 I ca n't blame Amazon but I can blame Feit .",negative
I really hate this game,negative
APPLE is to blame here .,negative
"Otherwise , I would n't waste the money .",negative
I did n't hate it but I would n't want to see it again,negative
I do n't know it was ok .. I did n't hate it but I would n't want to see it again .,negative
Before I was able to actually go for a run with the headphones but now they are very lose and will definitely slide if you 're not careful .,negative
"Its one of those movies that even though you hate it , you ca n't stop watching it to see where it ends .",positive
I hate the cost of ink but that has nothing to do with this printer .,negative
And they getting hurt me inside to your ears where you put that bud part .,negative
They are made in china and appear to suffer from Quality assurance and Quality control problems .,negative
"Once past the first chapter , however , the entire writing style changed , and seemed to lose its strength and focus .",positive
I had several fail within 30 days and had the set replaced .,negative
Now I have had 3 more fail within the first year .,negative
Feit products are garbage and prematurely fail .,negative
"The film is hurt by the lack of focus on any one character : Who are the heroes , the magicians or the crime investigators ?",negative
They hurt the inside of your ear after about 30 minutes .,negative
"Great writing , complex characters , a big loving family that hooks you in , you just ca n't lose .",positive
I doubt it even looked this good in theaters .,negative
Why did I waste so much time on this movie ?,negative
Stanly does n't fail to deliver with this model .,positive
"The headband is not too comfortable , after about an hour the top of your head will hurt .",negative
"If you are a muncher , as I am , this is a good way to have your munch and lose weight at the same time .",positive
"Maybe his 1993 self titled pop music album makes up for these books , but I doubt it .",negative
