sentence_text,answer
I tend to get a lot of complaints from my online friends that they can hear my game audio and chat audio and it creates a horrible loop ...,negative
"After being a tester for a new drug , he starts having horrible visions of a mud - like monster .",negative
This remake does away with the original dub and introduces an absolutely horrible American dub .,negative
"This expansion introduces tons of annoying crashes and bugs into the old levels , and one major game killer on The Docks that makes the level unfinishable .  ",negative
"Christine takes credit for New Christine 's birthday present for Richard , which causes many angry issues to arise between the two women .",negative
"I have the attachment for the Kitchen - Aid stand mixer but the "" pasta "" it produces is fairly horrible .",negative
"This creates a terrible problem , and a potential accident waiting to happen for the dog when its walking .",negative
"She will scratch her ears , neck , underarms , back of her front arms until she literally bleeds and creates terrible wounds that are simply horrifying .",negative
The white gloss paint causes a terrible reflection back into the lens of the camera .,negative
Ashley Galloway 's performance creates an annoying film,negative
I would n't normally take a star off for an accessory but it is bad design to include a wrist - rest that ENCOURAGES bad ergonomics .,negative
besides the annoying loud noises it creates while cooking,negative
It produces a huge amount of front port noise that 's just horrible during low bass music playback !,negative
"Wen in use with amplifier , it   produces a loud cracking or popping sounds that is very annoying .",negative
The world that Rick Yancey creates is harsh and horrible .,negative
"Feels solid , but it loosens as you shoot and causes horrible grouping .",negative
Yancey creates a dystopia that is unspeakably terrible .,negative
I 've watched friends who had parents with Alzheimer 's disease and have seen the terrible effects it produces .,negative
As previously posted the sizing of this article is not highlighted - it creates a negative experience to pay for returns,negative
There are three seams that converge between the index finger and thumb which creates a very annoying point in the glove .,negative
the driver circuit in this thing introduces a very annoying whining noise into your car radio .,negative
Does n't taste as terrible as the terrible fish smell it produces !,negative
"The light adds 100 + dollars to the system , but causes a bad taste .",negative
The slightest release of the clutch causes terrible wheel spin and depending on the vehicle the associated wheel hop .,negative
She also encourages a lot of bad behavior .,negative
"Sure it lights up cool , but it produces an annoying humming sound that 's ...",negative
"Sure it lights up cool , but it produces an annoying humming sound that 's more high pitched than my other fans .",negative
The portrait Diaz creates of the DR is nearly totally negative .,negative
"This film has its critics , especially those who find it formulaic and even the naysayers who warn of the "" bad parenting "" it encourages .",negative
"Heats an area quite well , but vibrates a lot , which causes an annoying noise .",negative
The sax creates a sad solemn sound .,negative
I just got a bigger dog and going to buy a bigger one for her before she develops any bad walking habits as my other dog did,negative
I read pretty far into the books ( nice writing for the first couple mini stories ) then it just creates stupid issues to make the books longer .,negative
"My dog has a skin condition that causes bad breakouts , dandruff like flakes and scabby sores .",negative
I 'm not a switch so this creates fear and some bad feelings .,negative
"I 've pulled these out of my cabinets a few times to use , after a long time out , only to be disappointed each time by the bad taste the open spout generates .",negative
"Some back and forth action , but the crowd becomes disappointed with the match and starts a boring chant .",negative
My daughter bought this at her school book fair last week and I 'm shocked at the negative behaviors it promotes .,negative
There are absolutely ZERO values to be learned from this book and it actually encourages negative behavior .,negative
the way the rope attaches into the handles creates an annoying bounce at the base of the rope .,negative
It causes upset stomach and sleepiness .,negative
The Google Maps is crippled on Windows Phone and the default Nokia software provides terrible direction .,negative
When you 're in a dark room it creates an annoying blue light .,negative
This racquet encourages bad habits in your swing due to the ease of power it provides .,negative
"That sadly causes a vibration noise that can really be annoying , so I had to prop something in there to deaden the vibration and noise .",negative
"Sally saw success with it once , but as she continues it only creates bad cinema .",negative
There is an unfortunate incident which occurs in a Chinese hospital that is captured by CNN television live ... it creates a serious negative impact on the Chinese economy .,negative
"do n't buy the polyester version of these , stay with cotton , polyester anything causes bad smells fyi .",negative
He is unable to sit up or hold his head up and takes a medication that causes horrible reflux .,negative
"This soundbar produces a horrible amount of scratchy noise , almost like a speaker in it is broken , but I ca n't see how it would be .",negative
This provides negative connections for all corresponding positive loads .,negative
"What started out as a trip to Paris turns into a living nightmare , literally , when Cat starts having horrible nightmares .",negative
"Howarth sings once again , and his voice once again distracts and provides an annoying cartoony feel to the song .",negative
"Eventually , he proposes to Laney and begins a miserable four years of postponing the wedding .",negative
"then it starts leaksoil and gas , noisy , terrible smell , then I stop it , and it wo n't start",negative
"Apparently a clean signal gets to the PC , but the EZgrabber software is overloaded and creates really bad videos and lousy or missing sound .",negative
This is a very serious issue in my line of work and creates very bad customer perception .,negative
"These diapers are scented , they have some sort of powder in them that causes a really bad rash on my little ones bum .",negative
"Low current draw causes stupid Dodge to hyperflash , just need to add load to fix .",negative
Just the bump it creates is annoying,negative
Just the bump it creates is annoying .,negative
The back gets clogged with dust which creates an annoying high - pitched sound .,negative
A bad war produces bad effects,negative
"In the end , Cabin Fever offers a cinematic experience that causes an annoying itch in the mind , why did I pay for this .",negative
Surprising Cleeves creates a boring disappointing mystery,negative
"Cats DON""T like the taste & causes upset GI tracts",negative
So Max of course picks on him and John throws one of his dead fishes into Max 's car which causes a terrible stench .,negative
THIS CUISINART PRODUCES A HORRIBLE METALLIC TASTE IN MY BREWED COFFEE ..,negative
"Very comfortable , however they seem to disconnect from my iPhone very easily which causes frustrating music loss .",negative
"This brand is the only one that causes the bad breath , so it has to be something in the food .",negative
As the first one this has the same problem : it develops bad contact after 16 months of using .,negative
The mic function causes a loud annoying hiss and i ca n't stand that and it makes the audio hard to hear while a live call .,negative
I do n't know what causes these bad boxes that look like a return that was just recycled back as a sale .,negative
... ring dries out and cracks then it creates an annoying buzz .,negative
That crack creates an annoying buzz .,negative
Moisture gets trapped under it and there is no way to dry it adequately ; it creates a HORRIBLE mildew problem both inside and outside the jar .,negative
It just causes Julian a ton of bad fame .,negative
"Additionally , the right button does not set flush with the mouse body and produces an annoying ridge .",negative
This also causes a terrible smell .,negative
"A month later , the left channel develops a terrible buzzing sound - its like   one of the armatures is shaking loose inside its enclosure .",negative
"On the high speed , however , it creates an annoying pulsing sound , so I just keep it on low .",negative
This causes an annoying ( to me ) amount of resistance when moving my phone around while it is on the charger .,negative
"These rinds have a good hot flavor , but cooking them in the microwave yields bad results .",negative
Everything in Alex 's life is going good until she starts having horrible nightmares that are more like memories from the horrible time she spent with her monster .,negative
My car produces terrible noise and alternator whine .,negative
I left this film ( which I have seen twice ) feeling that terrible sense of disturbance that a nightmare creates .,negative
"But it is too big , runs hot , is too expensive , and produces bad quality white light .",negative
A friend of Kathy 's disappears and this starts a progression of horrible events .,negative
This product actually produces negative ions .,negative
This causes an annoying and disjointed listening experience which insults the original release .,negative
Every year my senior doggie develops bad spring allergies April - July .,negative
We recently purchased a Samsung front loader which causes horrible pipe banging throughout the house .,negative
Case is good but it causes a bad haze when you use the camera flash ..,negative
Once a black shirt with a sheen like this is ironed it produces a bad shine .,negative
"When attaching a GoPro to the light , it creates a pretty bad glare .",negative
We have 1 dachshund who can not eat regular food as it produces horrible growling sounds and gas .,negative
Not to mention the sad faces and grief it causes every time I take it them out to try it .,negative
Ford Escapes have a design flaw in their aerodynamics that creates an annoying buffeting that drives you crazy when driving with the windows open .,negative
Apparently the separate volume control ( or the connectors to and from it ) causes an annoying scratching and my mic cuts in and out .,negative
This produces a low and annoying buzz when hooked to the bedroom TV ( flat screen CRT ) but not when hooked to the family room HD LCD TV .,negative
It provides terrible bass response and over accentuates the highs .,negative
"The mic in my Beats Studio headphones does not work when using this adapter , furthermore , it produces a loud and annoying interference on the phone line .",negative
That and the slight inefficiency ( appx 80 % ) produces waste heat that is bad for the battery .,negative
1 . The spring vibrates when the car is in use and creates a bit of an annoying noise at times .,negative
"The way the connection affects Ramie is so horrible , that she must need some kind of help .",negative
"If I leave it on him all day , he develops terrible matting where the straps make contact with his fur .",negative
It creates massively annoying humming / buzzing at all brightness levels .,negative
Obviously they are n't deterred by the so called bad taste this creates .,negative
I 've said it before though : SmartAUTO on the newer models creates horrible photos indoors .,negative
This causes a slight but annoying flapping and means it is more sensitive to wind gusts .,negative
And that 's where he starts his stupid decisions .,negative
I kept on ending up flat on my back or my stomach which for me creates some pretty bad back pain .,negative
the hot water maker produces a terrible odor and taste .,negative
I hope to never encounter a book that encourages such horrible violence again .,negative
"Although they are functioning adults , their baggage , especially Sean 's , causes terrible repercussions to their psyches .",negative
Indoors with little light creates terrible pictures .,negative
perch rotates and produces an incredibly annoying screeching when the birds are on it .,negative
Anything longer than the typical 6 ' causes bad humming .,positive
"Very bad , because it creates a negative exerience for radio listening .",negative
"Sucks , it is very slow and has vibration that produces "" The Most Annoying Sound In The World "" as similar to the one in the movie Dumb and Dumber .",negative
"It generates bad feelings on all sides . """,negative
He thinks it 's too expensive for the terrible coffee it produces .,negative
The lucid descriptions he provides of each phylum are heartbreaking .,negative
"Shortly after Ava started her new job a stranger seeks her out , and starts a terrible fire that kills almost all of the people she works with .",negative
"We love our morning coffee , and we use French Press ; this grinder produces very disappointing and inconsistent results .",negative
"This creates a book that is boring and unreadable , unlike the pleasantly quirky books he usually writes .",negative
But unfortunately the buzzing / whistling sound it generates is really annoying .,negative
A lot of people are nuts on the street and if they think you looked at them it causes a negative encounter .,negative
I am VERY disappointed with Amazon for doing business with a company that produces such a horrible product .,negative
It creates a horrible feedback for some reason that affects both my end and anyone in my team .,negative
Most are half - good which creates a disappointing listening experience .,negative
The rubber at the bottom of this bowl continues to come off and creates a frustrating task trying to get it back on .,negative
This causes some pretty bad problems for the valiant crew of the Enterprise .,negative
"Worked great at first , but after about 2 months it causes terrible static - y crackling noise constantly for no reason .",negative
This creates frustrating feathery sweeps down into the stone that are noticeable if the stone is dark colored .,negative
"However , the video part of this cable is not shielded and is of such low quality , it produces terrible video with lines and waves .",negative
This creates a terrible rattle .,negative
"It barely charges the car battery before it runs out , and when it runs out , it starts an annoying chirping sound that is deafening .",positive
"She also is very small , which causes negative body issues , especially next to Six , who is huge .",negative
"This action causes town gossip , police investigations , bad dreams , and eventually some haunting visions .",negative
"The grinding material is off center and causes terrible vibration , this in turn causes it not to polish smoothly .",negative
"On "" House of Lords , "" a team of no - name producers creates boring and unimaginative beats .",negative
this creates a slightly annoying brushing noise when exercising vigorously .,negative
The foam provides a BAD seal .,negative
"As one might imagine , this creates terrible pain for everyone , though it enables them to survive as a community in demographic stasis .",negative
"The DVD starts out by asking you a ton of stupid questions which , for those seeing the movie for the first time , would help to give away some of the movies mystery .",negative
One thing I have noticed is that when I start to increase the settings with this pedal specifically it creates a hum from my amplifier that is pretty annoying .,negative
"This ultimately creates a headache , anger , and other bad emotions .",negative
"Also , this copy did not have breaks between the scenes and that causes a flow issue , albeit not a horrible one , just annoying .  ",negative
A decent speaker package but the subwoofer produces a terrible rattling and Onkyo has no customer service,negative
Not often when things work too well that causes an unexpected negative consequence .,negative
Anything that yields unhappy wife only gets one star .,negative
"It 's not the waste itself , but the litter develops a horrible smell .",negative
I worry that the sensor comes loose in high speed and causes bad accident .,negative
This causes a very annoying vibration that is amplified by the air duct .,negative
"It promotes the whole mallcore culture in general , which is as bad as promoting the lately homoerotic and rebellious Saddam Hussein .",negative
The rosin produces a horrible smell like I 've never experienced ...,negative
In doing so ... he also provides a heartbreaking account of what went wrong .,negative
"Another thing , after the lead "" actor "" uses his magic pansy and it causes horrible results he just keeps using it !",negative
Lowndes ' performance yields one of the most annoying characters I have seen on film in recent memory .,negative
"However , it is really sensitive to the power supply and introduces a horrible digital hum when run after my King of Tone clone on my 1Spot chain .",negative
"Because of the sugar alcohol , this candy , while   tasty , causes really bad gas .",negative
"Contains maltodextrin which causes upset stomach and even dizziness in some people ( me , for one ) .",negative
"Even at its "" Turbo "" speed , the AP-230PH generates a not - very - annoying white noise background sound that is easy to ignore .",negative
"Front muzzle attachment causes pretty bad drag for darts ( I bought two of these , and both have the same problem ) .",negative
"I love the taste of this and the low calories , but I HATE the terrible GAS it causes and have quit using it .",negative
"First , the red side is too dark and provides bad ghosting .",negative
Plaque not only causes periodontal disease but doggie bad breath .,negative
"The camera does n't tilt down very far , which creates annoying blind spots when you set it on a shelf or something .",negative
"Uninspired art coupled with a very poor adaptation creates an unhappy experience , neither educational nor enjoyable .",negative
It causes terrible diarrhea so be careful not to put it anywhere your animals can get to .,negative
"However , it produces a horrible rattle if the volume is turned up past 30 % .",negative
"Every time the belt seam goes by the workpiece , it causes a thumping sound which is annoying .",negative
"It works well for low frequencies , but it causes a constant ear pressure that is really annoying and slightly uncomfortable .",negative
The problem is that the rubbing of the cord against anything creates horrible noise .,negative
She never does set him straight and develops a bad reputation in her small town .,negative
It produces a horrible crimp and with every strike of the hammer the crimp gets worse not better .,negative
This rear design flaw also causes a horrible reflection when out in direct sunlight .,negative
Really tight in the thighs which causes bad lines in clothes,negative
"He takes a ton of topics that pretty much have nothing to do with each other , crams them together and produces a horrible plot .",negative
"Annoyingly , here you 'll often hear silence between the tracks and it creates a frustrating disjointed "" concert "" experience .",negative
"I 'm not sure why , but it never seems to be dry enough and if the lid is on it , it develops a horrible smell .",negative
This product produces bad routing choices and the names of streets are mumbled .,negative
This creates an audible and extremely annoying buzz on most fans you connect it to .,negative
I will never ever buy another product made by this miserable company that provides such miserable support for their customers .,negative
"Shortly after telling my wife about the feedback I left ( above ) , she let me know that she thinks the towel develops a bad smell and has been washing it every other day .",negative
It is the yeast that causes ear infections and bad skin and coat .,negative
"However , it also introduces terrible hiss even when there is no music source ( and you ca n't get rid of it adjusting volume levels ) .",negative
"So when your phone is plugged in to charge AND also to the audio input , you 'll get a ground loop which produces nasty and annoying static in the pauses between songs .",negative
"Another one produces completely miserable quality , with blurred lines especially toward the end of a page or on a page that is not the first page .",negative
I have had at least 1 egg boil somewhat out of the hole in each batch which causes a terrible residue .,negative
"A small , barely noticeable gap between the screen protector and phone causes a minutely annoying pop around edges when typing .",negative
Messing the value of money causes bad decisions .,negative
That starts a horrible time in Lisa 's life when she is kidnapped by religious fanatics .,negative
It causes horrible whistling .,negative
"If you 're thinking about getting the Lifeproof case do n't , there is a problem with it that causes a great annoying echo .",negative
The picture quality this cable provides is horrible .,negative
"In fact , it directly encourages disordered eating and a negative relationship to food , as the author would know if he knew anything at all about food psychology .",negative
The biggest problem I had is that the band loosened from the watch body which causes an annoying rattle .,negative
The only problem is that the gussets where the zipper and laces come together creates a catch all ... bad for welding .,negative
"I mean really bad video quality .. that ca n't pick up sounds well , and provides a really cheesy terrible looking picture .",negative
The print on many applications is so tiny that it causes terrible eyestrain .,negative
"This manufacturer provides a negative meaning to the term , "" made in America . "" 

",negative
"Taste the Secret takes the same style , and mixes it up with a quirky theme that provides one of the most disgusting ( but funny ) hip hop songs I 've ever heard ( MeatShake ) .  ",negative
Take heed : poor engineering design in these units produces a very bad heat management system in these units .,negative
"Also , one of the "" distant TV "" outputs produces an annoying pop / zap sound on the TV that is hooked to it every 20 - 30 seconds .",negative
* Sometimes the monitor produces a quiet yet slightly annoying buzzing noise .,negative
Only negative is the horrible wind noise it produces .,negative
"This creates very bad line hum , unless the mini - plug is tightly secured .",negative
"I am leaving my original posting to show how an bad situation produces an upset person who then writes a rant that , at the time , was seemingly true but in fact was NOT the monitors fault !  ",negative
The edge is highly reflective and creates bad glare around the picture in a work environment .,negative
"It produces a annoying vibrating hum during printing , but it does n't last long .",negative
It produces an annoying coveting every 25 seconds,negative
It produces an annoying vibration every 25 seconds .,negative
Isolation provides a terrible backdrop for descriptive writing .,negative
Anything with bass causes terrible distortion .,negative
"As a result the machine overflows , creates a terrible mess , and in the latest case wrecks the machine .",negative
This not only wastes energy it also causes pump cavitation which is really bad for the pump .,negative
"This is a film for the entire family , especially the musically inclined family , and provides a delightfully charming evening 's entertainment .",positive
Lawbead develops an amazing personal journey of the historical Saint Patrick .,positive
"With a proper light setup and adjustments made in the webcam settings , it produces a really good , clear image .",positive
This link provides a good comparison for which switch type might be best for you .,positive
This set provides an excellent selection of high quality charcoal pencils that are a great starter set for anyone .,positive
Amazon provides choices and very good prices .,positive
"The fact that there 's a dimmer switch , it heats the oil and releases the aroma beautifully , the glow it provides is all nice .  ",positive
It provides a nice amount of water .,positive
"This product , combined with good external preamps , provides a great cheap solution for very good multitrack sound .",positive
"It provides a good amount of padding , is comfortable , fits well , and keeps your feet dry .",positive
The mobile app is very helpful and the website provides great information .,positive
It produces a nice amount of water pressure and is easy to operate .,positive
It produces good output .,positive
Funko produces another amazing detial character,positive
Funko produces such amazing detial again with this Jay character from the Kevin Smith movies .,positive
This actually provides a good amount of sound isolation .,positive
The console provides a nice multitude of metrics so nice to have all immediately visible .,positive
It provides good protection for the iPad when he carries it in his briefcase every day .,positive
"This is a fine product , easy on the ink and produces very nice documents at all levels .",positive
It provides a good connection to my wireless devices and performance is good in most areas .,positive
It fits well and produces great images without the need of photo enhancing software .,positive
I run # 1 diesel and it provides an amazing amount of heat .,positive
"Sweet , enamoring , pleasant , and funny , this story also provides us a brilliant lesson -- maybe SEVERAL brilliant lessons !",positive
"He effectively creates a fantastic , yet believable world in which your discomfort compels you to read on .",positive
The author creates a good base dialogue and a story of events that could have occurred .,positive
I have it in my mancave / command center / office and it provides great sound .,positive
